{
  "format_version": 1,
  "name": "Rev7 GBM2804H measured Rs/Ls/BEMF flux screening candidate, 2026-09-27",
  "profile": {
    "revision": 7,
    "board_id": "0x43116001",
    "board_name": "NUCLEO-G431RB + X-NUCLEO-IHM16M1",
    "motor_id": "0x28041007",
    "motor_name": "GBM2804H-100T"
  },
  "runtime_config": {
    "struct_size": 300,
    "config_version": 12,
    "observer_backend": 0,
    "observer_enable": 1,
    "closed_loop_enable": 0,
    "observer_update_divider": 1,
    "id_pi": {
      "kp": 7.5742607,
      "ki": 33789.363,
      "ts": 0.00008333333,
      "out_min": -7.1302757,
      "out_max": 7.1302757,
      "integrator_min": -7.1302757,
      "integrator_max": 7.1302757
    },
    "iq_pi": {
      "kp": 7.5742607,
      "ki": 33789.363,
      "ts": 0.00008333333,
      "out_min": -7.1302757,
      "out_max": 7.1302757,
      "integrator_min": -7.1302757,
      "integrator_max": 7.1302757
    },
    "speed_pi": {
      "kp": 0.0016926664,
      "ki": 0.005444589,
      "ts": 0.001,
      "out_min": -0.8,
      "out_max": 0.8,
      "integrator_min": -0.8,
      "integrator_max": 0.8
    },
    "pole_pairs": 7,
    "pwm_frequency_hz": 12000,
    "speed_loop_frequency_hz": 1000,
    "stator_resistance_ohm": 4.9666667,
    "stator_inductance_h": 0.0011133333,
    "flux_linkage_wb": 0.0053756875,
    "rated_current_a": 0.8,
    "max_speed_rpm": 1572.0,
    "nominal_bus_voltage_v": 13.0,
    "voltage_utilization": 0.9,
    "default_target_speed_rpm": 524.0,
    "alignment_duration_s": 2.0,
    "open_loop_ramp_duration_s": 5.0,
    "observer_transition_duration_s": 0.05,
    "startup_final_speed_rpm": 582.0,
    "startup_alignment_current_a": 0.8,
    "startup_current_a": 0.8,
    "observer_smo_k_slide_v": 4.0,
    "observer_smo_boundary_a": 0.24,
    "observer_emf_filter_alpha": 0.015,
    "observer_emf_phase_advance_ratio": 0.8,
    "observer_pll_kp": 40.0,
    "observer_acquisition_pll_kp_ratio": 0.6,
    "observer_pll_ki": 1000.0,
    "observer_minimum_speed_rpm": 524.0,
    "observer_acquisition_maximum_phase_error_rad": 0.65,
    "observer_minimum_bemf_v": 0.25,
    "observer_speed_variance_ratio": 0.01,
    "observer_consecutive_samples": 20,
    "observer_acquisition_timeout_s": 5.0,
    "observer_loss_timeout_s": 0.2,
    "closed_loop_speed_ramp_rpm_per_s": 500.0,
    "handoff_torque_support_ratio": 0.47,
    "speed_pi_preload_ratio": 0.2,
    "closed_loop_current_slew_a_per_s": 4.0,
    "observer_run_reliability": {
      "minimum_speed_rpm": 0.0,
      "maximum_phase_error_rad": 0.65
    },
    "angle_compensation": {
      "park_prediction_ticks": 0.0,
      "reverse_park_prediction_ticks": 0.0
    },
    "inverter_voltage_model": {
      "enabled": 0,
      "observer_voltage_correction_enable": 0,
      "pwm_feedforward_enable": 0,
      "pwm_carrier_frequency_hz": 12000,
      "dead_time_s": 0.00000055,
      "compensation_gain": 1.0,
      "current_zero_band_a": 0.005,
      "current_sign_filter_alpha": 1.0,
      "device_drop_v": 0.0
    }
  },
  "approval": {
    "parameters": {
      "approved": false,
      "approved_runtime_config_crc32": null,
      "reviewer": null,
      "approved_at_utc": null,
      "evidence": []
    },
    "closed_loop": {
      "approved": false,
      "approved_runtime_config_crc32": null,
      "reviewer": null,
      "approved_at_utc": null,
      "evidence": []
    }
  },
  "expected": {
    "runtime_config_crc32": "0x43135055",
    "record_crc32": "0x6BBE88FD"
  }
}
